{
  "format": "viento-scene3d",
  "schemaVersion": 1,
  "name": "3D primitives · 三维初步 · 3D入門",
  "viewport": [
    800,
    600
  ],
  "background": "#0d1829",
  "camera": {
    "position": [
      9,
      7,
      10
    ],
    "target": [
      0,
      1,
      0
    ],
    "fovDegrees": 50,
    "near": 0.1,
    "far": 1000
  },
  "light": {
    "direction": [
      -0.3,
      -1,
      -0.4
    ],
    "color": "#ffffff",
    "energy": 1.2
  },
  "objects": [
    {
      "instanceId": "40000000-1111-4111-8111-111111111111",
      "name": "Ground · 地面",
      "primitive": "box",
      "position": [
        0,
        -0.15,
        0
      ],
      "rotationDegrees": [
        0,
        0,
        0
      ],
      "size": [
        12,
        0.3,
        12
      ],
      "color": "#324761"
    },
    {
      "instanceId": "40000001-1111-4111-8111-111111111111",
      "name": "Tower · 方柱",
      "primitive": "box",
      "position": [
        -2,
        1.5,
        0
      ],
      "rotationDegrees": [
        0,
        25,
        0
      ],
      "size": [
        1.5,
        3,
        1.5
      ],
      "color": "#87d8b9"
    },
    {
      "instanceId": "40000002-1111-4111-8111-111111111111",
      "name": "Beam · 倾斜梁",
      "primitive": "box",
      "position": [
        1.5,
        1.8,
        1
      ],
      "rotationDegrees": [
        20,
        35,
        10
      ],
      "size": [
        0.6,
        0.6,
        4
      ],
      "color": "#f1c46e"
    }
  ],
  "particleField": {
    "center": [
      100000,
      -100000,
      100000
    ],
    "extent": [
      0.01,
      0.015,
      0.02
    ],
    "velocity": [
      1000,
      -1000,
      0.125
    ],
    "size": [
      0.001,
      0.001,
      0.001
    ],
    "color": "#aAccEe",
    "count": 4,
    "seed": 12345
  }
}
