{
  "format": "viento-scene3d",
  "schemaVersion": 1,
  "name": "3D primitives · 三维初步 · 3D入門",
  "viewport": [
    800,
    600
  ],
  "background": "#0d1829",
  "camera": {
    "position": [
      100000,
      100000,
      100000
    ],
    "target": [
      99999.999995,
      99999.98,
      100000
    ],
    "fovDegrees": 179,
    "near": 0.001,
    "far": 0.1
  },
  "light": {
    "direction": [
      5e-324,
      0,
      5e-324
    ],
    "color": "#ffffff",
    "energy": 1.2
  },
  "objects": [
    {
      "instanceId": "40000000-1111-4111-8111-111111111111",
      "name": "Ground · 地面",
      "primitive": "box",
      "position": [
        100000,
        -100000,
        100000
      ],
      "rotationDegrees": [
        35999.25,
        -35999.5,
        36000
      ],
      "size": [
        0.001,
        1000,
        0.001
      ],
      "color": "#324761"
    },
    {
      "instanceId": "40000001-1111-4111-8111-111111111111",
      "name": "Tower · 方柱",
      "primitive": "box",
      "position": [
        5e-324,
        -5e-324,
        0
      ],
      "rotationDegrees": [
        5e-324,
        0,
        0
      ],
      "size": [
        1.5,
        3,
        1.5
      ],
      "color": "#87d8b9"
    },
    {
      "instanceId": "40000002-1111-4111-8111-111111111111",
      "name": "Beam · 倾斜梁",
      "primitive": "box",
      "position": [
        1.5,
        1.8,
        1
      ],
      "rotationDegrees": [
        20,
        35,
        10
      ],
      "size": [
        0.6,
        0.6,
        4
      ],
      "color": "#f1c46e"
    }
  ]
}
